{
  "$schema": "https://json-schema.org/draft/2020-12/schema",
  "$id": "https://github.com/snubstar/automation/schemas/config.schema.json",
  "title": "Agent Milestone Orchestrator Config",
  "type": "object",
  "additionalProperties": false,
  "required": ["checks", "runner", "maxFixAttempts", "artifactRoot"],
  "properties": {
    "checks": {
      "type": "array",
      "description": "Shell commands to run during deterministic verification phases.",
      "items": {
        "type": "string",
        "minLength": 1
      }
    },
    "runner": {
      "type": "object",
      "description": "Selected agent runner adapter and its adapter-specific options.",
      "additionalProperties": false,
      "required": ["type"],
      "properties": {
        "type": {
          "type": "string",
          "enum": ["codex-exec", "fake"]
        },
        "command": {
          "type": "string",
          "minLength": 1
        },
        "accountLabel": {
          "type": "string",
          "minLength": 1
        },
        "options": {
          "type": "object",
          "additionalProperties": false,
          "required": [
            "sandboxForPlanning",
            "sandboxForImplementation",
            "approvalPolicy"
          ],
          "properties": {
            "sandboxForPlanning": {
              "type": "string",
              "enum": ["read-only", "workspace-write", "danger-full-access"]
            },
            "sandboxForImplementation": {
              "type": "string",
              "enum": ["read-only", "workspace-write", "danger-full-access"]
            },
            "approvalPolicy": {
              "type": "string",
              "enum": ["never", "on-request", "untrusted"]
            },
            "timeoutMs": {
              "type": "integer",
              "minimum": 1
            },
            "model": {
              "type": "string",
              "minLength": 1
            },
            "profile": {
              "type": "string",
              "minLength": 1
            },
            "jsonEvents": {
              "type": "boolean"
            }
          }
        }
      },
      "allOf": [
        {
          "if": {
            "properties": {
              "type": {
                "const": "codex-exec"
              }
            },
            "required": ["type"]
          },
          "then": {
            "required": ["command", "options"]
          }
        }
      ]
    },
    "maxFixAttempts": {
      "type": "integer",
      "minimum": 0
    },
    "maxCheckFixAttempts": {
      "type": "integer",
      "minimum": 0
    },
    "artifactRoot": {
      "type": "string",
      "minLength": 1
    },
    "milestonePlanPolicy": {
      "type": "string",
      "description": "Controls per-milestone implementation plan generation. Missing values default to always.",
      "enum": ["always", "auto", "light"]
    },
    "milestonePlanReviewPolicy": {
      "type": "string",
      "description": "Controls whether per-milestone implementation plans are reviewed before implementation. Missing values default to normal.",
      "enum": ["normal", "scrupulous"]
    },
    "humanReviewPolicy": {
      "type": "string",
      "description": "Controls how human-review-equivalent outcomes are handled. Missing values default to stop.",
      "enum": ["stop", "fail", "autonomous"]
    }
  }
}
