{
  "checks": [],
  "runner": {
    "type": "codex-exec",
    "command": "codex",
    "options": {
      "sandboxForPlanning": "read-only",
      "sandboxForImplementation": "workspace-write",
      "approvalPolicy": "never",
      "timeoutMs": 1800000,
      "jsonEvents": false
    }
  },
  "maxFixAttempts": 2,
  "artifactRoot": ".agent-work",
  "milestonePlanPolicy": "always",
  "milestonePlanReviewPolicy": "normal",
  "humanReviewPolicy": "stop"
}
